{"critic":{"actor_id":"critic","evidence_refs":["fixture-design:synthetic-only"],"findings":[]},"methods":[{"assumption_ids":["linearity"],"completes_task":true,"cost":{"memory_mb":null,"timeout_seconds":30},"fallback_trigger":null,"idea":"Least squares affine fit","method_id":"affine-main","outputs":["prediction"],"rejection_reason":null,"role":"main_candidate","source_refs":["problem:line1"],"validation_plan":["Independently recompute holdout MSE."]},{"assumption_ids":[],"completes_task":true,"cost":{"memory_mb":null,"timeout_seconds":30},"fallback_trigger":null,"idea":"Training mean prediction","method_id":"mean-baseline","outputs":["prediction"],"rejection_reason":null,"role":"usable_baseline","source_refs":["problem:line1"],"validation_plan":["Independently recompute holdout MSE."]}],"question_id":"Q1","schema_version":"2.0"}
